,review_lst
2276,예전에 샀던 쿨시리즈랑 달라요 예전꺼가 더좋아요(2023-06-24 14:32:46 에 등록된 네이버 페이 구매평)
2277,예전버전이 더좋습니다(2023-06-24 14:33:21 에 등록된 네이버 페이 구매평)
2278,잘 받아서 잘사용하고잇어요
2279,퓨어바닐라의 색상이 매우 은은하네요. 첨엔 좀 더워보이는 색상이지않을까 했는데 은은하니 넘 좋아요. 시원하며 실크처럼 부그러운 감촉! 남편덮으라 샀는데 제거됐어요. ㅎ 남편이불 하나 더 구매하러 갑니다~
2280,"벌써 바디럽 이불세트만 3번째 구입이네요..포옹이불, 바스락이불 이번에 쿨이불까지... 확실히 재질부터 촉감까지 다른 이불들이랑 차이가 나는게 안살수가 없네요 올 여름도 쿨 이불과 함께 시원하게 이겨 내겠습니다^^"
2281,남자친구가 이사해서 급하게 필요했는데 빠른 배송 덕분에 빠르게 와서 편하게 잤다고하네요 두께는 생각보다 두꺼운편은 아니지만 푹신푹신하고 촉감이 넘 좋다고하네요 저도 바디럽 사용해봤지만 정말 편하고 좋아요!(2023-06-23 23:51:48 에 등록된 네이버 페이 구매평)
2282,리뉴얼도었네요 빠른배송감사해요(2023-06-23 22:23:16 에 등록된 네이버 페이 구매평)
2283,리뉴얼되어서 엄마집에사드렸어요(2023-06-23 22:21:26 에 등록된 네이버 페이 구매평)
2284,사진에 손으로 들고있는 리뉴얼 전 제품이 훨씬 좋아요....비슷할줄알고샀는데 너무 별로에용..전 모델은 살 닿기만 해도 쿨링감있어서 시원한데이번거는 부드럽기만하고 덮고 누워 있으면 답답해죽을거같아요 바디럽 제품 항상 만족하고 썼는데 진짜 너무 별로에여..(2023-06-23 12:34:16 에 등록된 네이버 페이 구매평)
2285,땀 많은 아들 여름침구로 바꿔줬어요.넘 시원하고 쾌적하다네요.일단 컬러가 진하고 시원해서 땀으로 인한 변색도 안보일거라 더 좋아요.
2286,다음에 또 재구매 할게요.(2023-06-21 21:57:16 에 등록된 네이버 페이 구매평)
2287,부드러워요 재질도 시원하고(2023-06-21 15:58:12 에 등록된 네이버 페이 구매평)
2288,계속 바디럽에서만 이불 샀었어요 여름 이불도 여기서 두 세트 샀는데 만족합니다(2023-06-20 22:05:37 에 등록된 네이버 페이 구매평)
2289,진짜 시원하네여 여름용으로 짱(2023-06-20 21:36:46 에 등록된 네이버 페이 구매평)
2290,땀띠나는 중딩 아들용으로 구매함!맘에 들어하고 잘 사용하고 있어요~^^(2023-06-20 20:48:55 에 등록된 네이버 페이 구매평)
2291,너무 마음에들고 좋아요~!다음에 또 주문할께요~!(2023-06-20 15:38:59 에 등록된 네이버 페이 구매평)
2292,품질 마감이 거지같아요별로 시원한지 모르겠어요
2293,품질마감이 거지같아요별로 시원한지 모르겠어요
2294,더위에 약한 딸.너무 좋아 하네요.
2295,세번째 구매입니다. 시원하면서도 도톰해서 아주 유용해요
2296,"금요일 주문했는데 토요일 도착, 완전 하루 배송입니다:) 더위를 많이 타는 아이를 위해 침구를 바꿔줬는데 편안하게 잘 잤으면 좋겠어요~"
2297,시원하게 잘 자고 있습니다^^ 감사합니다.(2023-06-16 20:11:27 에 등록된 네이버 페이 구매평)
2298,정말 신기한 이불이에요 ㅋㅋㅋ 너무 잘 사용하고 있습니다.(2023-06-16 20:09:01 에 등록된 네이버 페이 구매평)
2299,포장 꼼꼼하고배송빠릅니다가볍고 시원하고 좋아요
2300,부드럽고 시원하니 좋은것 같아요.(2023-06-15 14:26:23 에 등록된 네이버 페이 구매평)
2301,시원하고 좋은데 네이비라 먼지는 좀 잘 보여요~(2023-06-15 14:25:25 에 등록된 네이버 페이 구매평)
2302,눕자마자 냉감이 들어서 좋았어요.이불도얇아서 가볍구요.(2023-06-15 13:01:38 에 등록된 네이버 페이 구매평)
2303,생각보다 두꺼워요그래도보들보들해요(2023-06-14 20:27:04 에 등록된 네이버 페이 구매평)
2304,친구추첨으로 구매했어요 지금은 세탁해서 건조시켜놨어요 만져봤는데 시원해보여요!!(2023-06-14 15:44:17 에 등록된 네이버 페이 구매평)
2305,촉감도 부드럽고 시원해요!!!!(2023-06-14 15:06:47 에 등록된 네이버 페이 구매평)
2306,아직 열대야는 아니지만 지금까지는 만족합니다.(2023-06-14 10:20:20 에 등록된 네이버 페이 구매평)
2307,세련돼고 색깔예뻐요3번째 구매에요(2023-06-13 23:36:23 에 등록된 네이버 페이 구매평)
2308,자는데 갑자기 더워져서 바로 구매 했습니다색감이 너무 예쁘네요슈퍼싱글 사이즈가 생겨서 너무 좋아요패드는 밴딩이 가능해서 더 좋네요(2023-06-13 19:00:10 에 등록된 네이버 페이 구매평)
2309,자는데 갑자기 더워져서 바로 구매 했습니다색감이 너무 예쁘네요패드는 밴딩이 가능해서 더 좋네요(2023-06-13 19:01:01 에 등록된 네이버 페이 구매평)
2310,보들보들하니 넘 좋습니다^^(2023-06-13 15:47:46 에 등록된 네이버 페이 구매평)
2311,좋습니다 더위에약한데 시원해요(2023-06-13 13:48:15 에 등록된 네이버 페이 구매평)
2312,이불너무좋아요 가볍고 부들부들하고 시원해요(2023-06-13 13:47:42 에 등록된 네이버 페이 구매평)
2313,몸에 열이 많은데 이불이 정말 시원하고 좋습니다(2023-06-12 22:42:31 에 등록된 네이버 페이 구매평)
2314,아주 시원하고 좋아요(2023-06-12 21:42:22 에 등록된 네이버 페이 구매평)
2315,부들부들 시원해요 ㅎ(2023-06-12 21:41:53 에 등록된 네이버 페이 구매평)
2316,더운데 도움되는데 만지면 새거여서 그런지 하얀 먼지같은게 일어나요 빨래하고 쓰면 괜찮을려나(2023-06-12 11:21:20 에 등록된 네이버 페이 구매평)
2317,시원하고 좋답니다...우리 애들이^^
2318,남편이 자면서 땀을 많이 나는 편인데 아침에 개운하다고 하고 면소재도 부드럽고 시원해서 너무 좋아하네요남편이 좋아하니 저도 기분이 좋네요번창하세요(2023-06-11 14:05:47 에 등록된 네이버 페이 구매평)
2319,피부예민하시면 절대비추입니다피부다일어나요 사자마자세탁하고썻는데도 뭘로만들었나알러지엄청심하게일어나고세탁1번했는데. 매트는바로찢어짐(2023-06-10 23:53:22 에 등록된 네이버 페이 구매평)
2320,너무 보들보들하고 시원해요. 딱 원하는 제품이었어요(2023-06-10 18:46:10 에 등록된 네이버 페이 구매평)
2321,같은 색이 지루할것같아 오빠랑저랑 다른색으로 콤비로맞췄어요.저는민트보단ㅊ연하늘 좋아해서 일단 이불이양면이에요 한면은 빤딱빤딱 빛나는 면이고 아주시원~다른면은 좀더 보온성이 느껴지는 포근한면.오빠는 바스락거리는소리에 정말민감한데 전혀소리도없고.보드랍고.받자마자세탁했는데 반나절만에 건조됬어요. 아주시원하고 맘에듭니다.어제 꿀잠잤어요.근데 아주 한여름엔 좀덥지않을까 싶습니다. ㅡ근데한여름엔 이불자체를 차버리니 괜찮겠지요^^♡
2322,아이가 더위를 많이 타고 모기 물리면 붓고 가려워서 엄청 고생하는데 이런 신박한 이불이 있다니 놀랍네요.양면 촉감도 다르고 엄청 시원해서 올여름 기운나게 지날거 같아요(2023-06-09 23:44:37 에 등록된 네이버 페이 구매평)
2323,올여름을 위해 이것저것 검색하다 요아이로 선택(2023-06-09 20:03:07 에 등록된 네이버 페이 구매평)
2324,이불이랑 선풍기로 아직 에어컨 안 틀고 버텼어요ㅎㅎ 계속 덮고 잇으면 몸에 열때문에 이불도 따끈해 지지만 처음에 시원하고 보들보들해서 너무 좋아요 베개 커버가 많이 얇은거 같아서 그것만 조금 아쉬워요 새깔은 딱 피스타치오에요 제 사진이랑 색감은 좀 다릅니다~ㅎㅎ(2023-06-09 16:58:57 에 등록된 네이버 페이 구매평)
2325,포장과정에서 접착을 제대로 안한거겠죠?누가 뜯어본상품은아니라 생각합니다..ㅡㅡ일단세탁전이라 아직 모르겠는데살짝 만져봤을때 시원한느낌은 나더라구요덮었을때효과가있기를 기대해봅니다(2023-06-09 07:57:15 에 등록된 네이버 페이 구매평)
2326,포장과정에서 접착을 제대로 안한거겠죠?누가 뜯어본상품은아니라 생각합니다..ㅡㅡ일단세탁전이라 아직 모르겠는데살짝 만져봤을때 시원한느낌은 나더라구요덮었을때효과가있기를 기대해봅니다(2023-06-09 07:56:38 에 등록된 네이버 페이 구매평)
2327,정리를 하지않아 좀 구겨졌지만... 정말 시원한것 같아요..땀이 많은 아이를 위해 하나 더 구입해야겠어요..
2328,배송도 빠르고 너무 좋네요(2023-06-08 23:31:23 에 등록된 네이버 페이 구매평)
2329,배송도 빠르고 너무 좋아요(2023-06-08 23:31:51 에 등록된 네이버 페이 구매평)
2330,시원하고 좋은데 먼지나 이물질이 잘 붙네요(2023-06-08 21:51:03 에 등록된 네이버 페이 구매평)
2331,여름준비 여름 이불 삿는데 너무 가볍고 좋네요(2023-06-08 17:38:50 에 등록된 네이버 페이 구매평)
2332,너무너무 시원하고 부드러워서 좋아요
2333,리뉴얼이후로 별로에요 ㅠㅠ(2023-06-07 23:32:23 에 등록된 네이버 페이 구매평)
2334,예전에 리뉴얼전이 더부드럽고 좋은거같아요ㅠㅠ이런느낌인줄알았으면 안샀을텐데 아쉽네요ㅠㅠ(2023-06-07 23:31:11 에 등록된 네이버 페이 구매평)
2335,리뉴얼이후로 별로에요 ㅠㅠ(2023-06-07 23:31:50 에 등록된 네이버 페이 구매평)
2336,바디럽의 겨울발열이불이 정말 좋아서 쿨이불도 묻지도 따지지도않고 주문했다.촉감은 정말 좋다.바디럽은 따뜻한이불을 잘 만드는거같다.쿨이불이 따듯하다ㅠㅠ(2023-06-07 22:03:45 에 등록된 네이버 페이 구매평)
2337,만족합니다 만족합니다(2023-06-07 17:13:34 에 등록된 네이버 페이 구매평)
2338,ㅠㅠ생각만큼 엄청 시원하지는 않은 것 같아요 그리고 가격도 싼 편도 아닌데 그냥 비닐에 싸여서 온 것두 좀..ㅠㅠ 그리고 색감도 블루보단 민트에 더 가까운 것 같네옴..(2023-06-07 11:14:18 에 등록된 네이버 페이 구매평)
2339,시원하고 좋네용 감사합니다(2023-06-07 02:10:36 에 등록된 네이버 페이 구매평)
2340,시원하니 부드럽네요리뷰많은 이유를 알거같아요(2023-06-06 19:45:46 에 등록된 네이버 페이 구매평)
2341,이불이 어떻게 이런 느낌인건지 참 신기하네요첫촉감은 시원하면서 부드러워요재구매 할께요(2023-06-06 19:44:17 에 등록된 네이버 페이 구매평)
2342,"이불 색이 맘에 들고, 피부에 닿았을 때 시원한 감이 있지만, 더위 많이 타는 저는 한여름엔 못 덮을것 같네요."
2343,시원하게 잘 사용하고있어요~~!!
2344,원래 바디럽 이불 사용하고 있었는데 여름 이불도 바디럽 제품으로 구매했어요~! 만지면 바로 냉감이 느껴집니다 패드랑 같이 구매했는데 바로 세탁해서 누워보니 올 여름 시원하게 보낼 것 같아여!!만족합니다 베게도 같이 살껄그랬나봐여(2023-06-03 20:16:53 에 등록된 네이버 페이 구매평)
2345,쾌적한 느낌이 들고 색이 마음에 들어요. 겨울용에 이어 여름 이불도 실망시키지 않네요(2023-06-03 18:38:39 에 등록된 네이버 페이 구매평)
2346,촉감도 좋고 색감도 좋아요(2023-06-03 17:21:57 에 등록된 네이버 페이 구매평)
2347,여러번 구매햇네요 조아요(2023-06-03 02:00:34 에 등록된 네이버 페이 구매평)
2348,좋아요 몇번째 구입햇네요(2023-06-03 01:59:31 에 등록된 네이버 페이 구매평)
2349,시원하고 좋아요 작년에 써보고 좋아서 두세트 재구매했어요 다만 베개커버가 한겹이라 좀 아쉬워요
2350,이불세트 년에 사용해보고 두세트 더 재구매 했어요시원하고 좋아요
2351,"이왕 마음먹고 구매하는 거 ...💚🫶🏻☺ 셋뚜셋뚜 통 큰 소비 손 덜덜했지만, 막상 제품 받고 나니 하하하하하 뿌듯합니다 남동생에게 직접 사용감을 물어보니 타브랜드에서 구매한 매트리스와 다르다고 하네요 ""이전 보다 훨씬 푹신하더라 씻고 앉는데 푹들어가서 놀랏어""라고 카톡이 왔어요 선물하고 뿌듯하네요 이불 촉감도 좋다며 🌿 오랜만에 시원 뽀짝하게 푹 잤나봐요 패트에 살짝 이염되서 연락을 드릴까 하다가 그냥 세탁해서 사용하기로 했어요 검품할때 이부분만 좀더 체크 하시면 더 많은 소비자에게 사랑 받을것 같아요 후잉 ☺바디럽 홈페이지 잠깐 들어와서 ㅋ 세상에 60만원 넘게 쓴 사람 나야나!!필요한 제품 검증된 곳에서 좋은재품으로 구매했다며 셀프 칭찬 했습니다 ㅋㅋㅋ😆 빠른 배송도 너무 마음에 들어요🫶🏻❤"
2352,색상이 예쁘고 시원해요!(2023-06-02 22:35:53 에 등록된 네이버 페이 구매평)
2353,벌써 두번째 삽니다. 너무 좋아요. 작은방도 이걸로 바꿨습니다.(2023-06-02 00:28:44 에 등록된 네이버 페이 구매평)
2354,조금 더 사용 해보아야겠지만지금은 아주 만족합니다
2355,계속 이용중이에요 또 이용해요(2023-06-01 18:15:22 에 등록된 네이버 페이 구매평)
2356,바디럽에서 이불세트를 여러번 구매했는데 처음으로 이렇게 올이 풀려서 그것도 두군데나 😂 꼼꼼한 마무리가 필요할듯 합니다
2357,얇고 가볍고 몸에 달라붙지 않아서 좋지만안티버그는 아직 잘 모르겠네요! 그치만 시원해서 좋어요
2358,이전에 쿨이불세트 사용했었고이사하면서 새로 구매했어요배송도 빠르도 역시나 맘에듭니다 ㅎㅎ저희집 고양이들도 쿨이불에서 안내려옵니다....한세트 더 주문해두려고해요... 최고예요..!
2359,우선 싱글로 제꺼 먼저 사봤는데 남편이 무척 탐내 합니다ㅋㅋ 고양이들도 와서 누워있어요ㅋㅋ확실히 쿨링감이 있어서 쾌적해요 끈적이는 느낌이 없는게 가장 좋아요! 에어컨+바디럽이불 꿀조합 입니다(2023-05-30 18:32:31 에 등록된 네이버 페이 구매평)
2360,부드럽고 시원하고 아주 좋습니다(2023-05-30 06:05:03 에 등록된 네이버 페이 구매평)
2361,바디럽 초기에 냉감이불 사서 잘 쓰고있어서 재구매 하러 왔더니 바뀌었더라고요. 더 좋아졌겠지 하고 구매했는데일단 촉감은 전 시즌에 나온 이불이 더 보드러워요.그이불도 냉감기능 적당하니 좋았는데.  요번 상품도 오늘 덮어봐야 알거같네요. 두께감도  전 시즌보다 더 도톰하고요.  근데 전시즌 모델은 이제 구매할수 없나요?
2362,둘째 아이 먼저 사서 써보고 첫째도 사달라고 해서 재주문했어요~ 양면이 달라서 그날 그날 기온 상태 변화에 따라 사용할 수 있어서 좋아요..
2363,너무 좋습니다 감사합니다 번창하세요(2023-05-29 11:50:57 에 등록된 네이버 페이 구매평)
2364,부드럽고 얇아서 여름용으로 좋아요(2023-05-28 19:56:54 에 등록된 네이버 페이 구매평)
2365,이불이 양면이 달라서 좋아요. 바스락 거리는 느낌도 좋아요. 살에 닿으니 시원하네요
2366,침대에 누어 계시는 아버지에게 드렸는데 시원하다고 너무 좋아하세요
2367,생각했던 촉감은 아니에요좀 특이해요(2023-05-27 19:43:58 에 등록된 네이버 페이 구매평)
2368,촉감이 부드럽고 이불을 덮으면 시원한 느낌이 확실히 느껴집니다세탁한 뒤에도 건조시 잘 말라서 좋아요 !개인적으로 검정색 있으면 좋겠어요 !(2023-05-27 09:59:11 에 등록된 네이버 페이 구매평)
2369,이불도 시원하고 패드도 좋네요 재구매 생각입니다 좋아요
2370,색상이 넘 맘에 들었고 정말 시원한 소재라서 여름에 덥지 않게 잘 것 같아요 근데 이불이 3중인데 겉에가 너무 따로 놀아서 조금 불편..? 일체형은 아니네요(2023-05-26 23:53:02 에 등록된 네이버 페이 구매평)
2371,넘나 좋아요.재작년에 사고 또사는데 업그레이드 된 것도 좋네요(2023-05-26 16:45:01 에 등록된 네이버 페이 구매평)
2372,가볍고 시원하고 좋아요.(2023-05-25 21:49:48 에 등록된 네이버 페이 구매평)
2373,그냥 딱 사서 써봐야지만 알 수 있습니다!(2023-05-25 19:33:36 에 등록된 네이버 페이 구매평)
2374,시원하면서 따뜻해요중딩딸램 만족하며 쓰고있어요
2375,배송이 빠르네요 촉감이 부드럽고 시원해요(2023-05-24 19:40:57 에 등록된 네이버 페이 구매평)
2376,한번 깔아보고 누워봤는데 시원한 재질이긴 하네요.잠은 안자봐서 모르겠지만 잠깐은 시원했습니다 ㅎ얇고 가벼워서 좋네요^^잘 덮어 볼께요~(2023-05-24 19:41:23 에 등록된 네이버 페이 구매평)
2377,아직 사용안해봤지만 만져보니 부드럽고 좋네요 이번 여름 잘 사용할께요(2023-05-24 19:39:14 에 등록된 네이버 페이 구매평)
2378,배송이 빨라요 부드럽고 시원한 감촉이네요(2023-05-24 19:40:15 에 등록된 네이버 페이 구매평)
2379,다른곳에서 여름용 매트와 베개 커버를 샀는데 엄청 실망했었어요..그래도 사기를 주저했는데 엄청나게 부드럽고 진짜 시원하고 행복지수 완전 높아졌어요ㅠㅠㅠ감사합니다(2023-05-24 00:21:54 에 등록된 네이버 페이 구매평)
2380,냉감 좋아요.엄청 시원한 느낌 빨리 기숙사 생활하는 조카도 사줘야 겠어요.
2381,재구매 상품으로 만족합니다(2023-05-23 15:38:34 에 등록된 네이버 페이 구매평)
2382,바닐라 색상 그냥 딱 무난한 흰색이예요. 촌스럽지 않고 괜찮아요. 촉감 좋고 올 여름 더울때 잘 쓸거 같습니다. 수퍼싱글인데 이불 큰게 좋아서 퀸 사이즈 했더니 딱 좋아요. 배송도 빨랐고 사은품도 보내줘서 감사합니다.
2383,이불이 진짜 시원하네요! 신기해요ㅋㅋ(2023-05-21 21:57:04 에 등록된 네이버 페이 구매평)
2384,시원하고 좋습니다.(2023-05-21 16:48:58 에 등록된 네이버 페이 구매평)
2385,느므 시원해요여름용으로 굿저희는베드가 슈퍼킹이라…사이즈맞는게 나왔으면 좋겠어요(2023-05-21 13:58:04 에 등록된 네이버 페이 구매평)
2386,아이랑 같이사용하려 구매했어요광고만 맨날보다가ㅋㅋ너무 시원하고 부들부들 좋아요~(2023-05-21 13:34:20 에 등록된 네이버 페이 구매평)
2387,좋아요  시원하고   세일해서   더좋아요
2388,쿨 그레이를 시켰는데 연두색임(2023-05-20 22:15:48 에 등록된 네이버 페이 구매평)
2389,시원할 거 같은데 사용해 보고 시원하다면 싱글로 하나 더 구입하고 싶네요(2023-05-20 21:32:57 에 등록된 네이버 페이 구매평)
2390,재질 시원하구 이번에 써보구 다시 재구매 할께요ㅔ(2023-05-19 19:00:16 에 등록된 네이버 페이 구매평)
2391,촉감이 부들부들하니 너무 좋습니다(2023-05-18 23:06:16 에 등록된 네이버 페이 구매평)
2392,겨울 구스 이불을 지금까지 덮엇더니 너무 더워서 하나 장만 했습니다 ㅎㅎ 기대중이예요(2023-05-18 21:54:27 에 등록된 네이버 페이 구매평)
2393,빠른배송감사합니다.(2023-05-18 10:56:11 에 등록된 네이버 페이 구매평)
2394,빠른배송감사합니다.(2023-05-18 10:55:39 에 등록된 네이버 페이 구매평)
2395,재질도 찰랑찰랑하고 너무 좋아요~(2023-05-18 01:00:49 에 등록된 네이버 페이 구매평)
2396,배송빠르고 쿨링감이 좋아서 만족합니다 !(2023-05-17 21:51:08 에 등록된 네이버 페이 구매평)
2397,촉감이 굉장히 부드럽고 피부에 닿으면 쿨링감이 진짜 좋아서 잠이 솔솔 오네요! 더위 잘 타는 편인데 끌어안으면 시원시원하니 좋네요! 컬러는 하늘색보단 살짝 민트가 섞인 느낌인데 전체적으로 맘에 듭니다 :)(2023-05-17 21:50:29 에 등록된 네이버 페이 구매평)
2398,베개 커버도 좋아요여름에 잘 써 볼게요(2023-05-17 15:49:02 에 등록된 네이버 페이 구매평)
2399,배송빨라요. 여름에 시원할거 같아요.(2023-05-13 20:55:02 에 등록된 네이버 페이 구매평)
2400,원래 포옹이불만 사용하다 여름기념으로 구매했는데 냉감도좋고 안티버그라좋네요(2023-05-12 22:09:12 에 등록된 네이버 페이 구매평)
2401,이불 촉감이 처음 느껴보는것 같아요! 포근하고 시원하구 에어컨 틀면 여름까지도 잘쓸것 같아요(2023-05-04 20:12:48 에 등록된 네이버 페이 구매평)
2402,배송빠르고 여름에 시원할꺼같아요(2023-04-23 13:34:36 에 등록된 네이버 페이 구매평)
2403,만족하고 꾸준히사용하고있습니다👍👍👍
2404,믿고 꾸준히사용하고 있습니다~  너무 좋아요👍👍👍
2405,베개를 좋아해서 추가로 구매해줬어요~ 구성해놓으니 아이가 좋아해요.
2406,조아용 무난합니다아아아(2023-04-11 22:17:34 에 등록된 네이버 페이 구매평)
2407,배송 빠르고 재질도 좋아요(2023-04-11 09:44:52 에 등록된 네이버 페이 구매평)
2408,아이들과 함께 덮으려고 세트로 구매했어요 컬러도 너무 예쁘고 촉감도 좋네요
2409,아이들이랑 같이 자는 패밀리 침대에 깔려고 세트로 구매했네요~ 컬러도 예쁘고 너무 만족합니다^^
2410,이이불 2개 주문했는데 한개만 왔어요
2411,몸에 열이 많은 아이에게 선물해 줬는데무척 좋아헙니다
2412,시원하긴 해요..근데 조금 쓰면 찢어질듯 약해 보이네요.망사가....
2413,전에 쿨이불과 달라졌어요.기존에 쓰던게 좋아서 재주문인데 이불감촉이..패드는 너무 얇아서 물빠진색 같고 오래 못쓸거 같네요 ㅜ2세트나 주문했는데 여기저기 소개도 하고 ㅎ암튼 좋길 바래요
2414,만족합니다 추천합니다
2415,만족합니다 시원한소재
2416,색감 좋고 배송빠르게왔습니다
2417,여자친구가 잠을 잘자네요(2022-10-07 13:11:03 에 등록된 네이버 페이 구매평)
2418,여름에 시원하게 잘 썼어요.바닥처리도 되어있어서 안 밀리고 좋아요(2022-10-04 00:17:58 에 등록된 네이버 페이 구매평)
2419,시원한 감촉은 알겠는데 안티버그가 되는지는 잘 모르겠어요. 모기 잘 달려들더라구요. 그리고 보풀이 잘 생기네요.(2022-10-02 21:09:24 에 등록된 네이버 페이 구매평)
2420,세일때 잘산거 같아요~~~!
2421,세일때잘산거같아요~~~~~!
2422,날이 추워져서 아직도 무서워서 이블 안고자는 아들방에만 사용중인데 넘나시원하고 촉감좋고 세일하길래 패드는 방방마다 덮는거는 개인마다 샀는데 너무 잘한거같아요 내년여름이 기대되네요
2423,생각보다 시원하지 않네요매트는 금방 보풀이 일어나고..한철용으로 사용하는 제품은 아닌거 같은데가격대비 품질이 너무 안좋은 거 같습니다(2022-09-28 08:27:37 에 등록된 네이버 페이 구매평)
2424,비추비추후회감이만땅 욍보풀(2022-09-22 20:13:34 에 등록된 네이버 페이 구매평)
2425,너무너무비추입니다.머리카락이불속으로다들어가고보풀다일어나고버릴판이에요(2022-09-22 20:12:26 에 등록된 네이버 페이 구매평)
2426,정말시원하고 좋아요근데 주름이너무많이져서 보기는안좋아요(2022-09-22 11:17:40 에 등록된 네이버 페이 구매평)
2427,화면 색깔보다는 좀더 밝은색이고 쿨이불이라 몸에 달라 붙지 않고 시원해요(2022-09-21 10:07:26 에 등록된 네이버 페이 구매평)
2428,쿨이불이라 덮고 자도 땀차지 않고 시원해요(2022-09-21 10:08:07 에 등록된 네이버 페이 구매평)
2429,꾸준히 구매하고 바디럽 좋아하던 구매자예요정말 어처구니가 없네요시그니쳐샤워기 구매하자마자 이음새부분에서 물이 질질 세어나왔어요.며칠걸려 교환하고 몇개월 지났는데 이번엔 필터볼 수 있는 손잡이 사이로 물이 콸콸..AS전화했더니 사진 찍어보내라고 해서 보냈는데 한참후에 전화 하더니 바디부분만 교환 할테니 분해해서 바디랑 고무패킹 잊지 말고 잘 싸서 보내고 어쩌구저쩌구...도착하은데 3~4일은 걸리고..3~4일동안 머리은 수도꼭지에다 감으란소리인지..소비자 과실도 아니고 이건 제품하자인데..여러분 사신 샤워기는 멀쩡한가요?소비자잘못이라도
